title,content,url,date,file_name
Sri Lanka denies allegations raised over participation at Dubai EXPO,"Sri Lanka has denied allegations raised over its participation at the Dubai EXPO, including with regards to the funds allocated and the events and activities organized by Sri Lanka Tourism.    

Chairperson of Sri Lanka Tourism Kimarli Fernando said that the former Government had made a 580 Million LKR commitment for the EXPO.   


She noted that the Official commitment of Sri Lanka took place on the 08th of July 2019, through the Export Development Board (EDB) and the contract signing ceremony was led by Nalin Bandara, the then Deputy Minister of Development Strategies and International Trade.  However, she said that with the pandemic outbreak, President Gotabaya Rajapaksa had issued a directive to optimise the usage of Government funds so the commitment was reduced to 155.5 Million LKR for the entire EXPO which is taking place from this month until March next year. This includes the funds of managing the pavilion with events and activations in Dubai for six months. She also said that the design of the Sri Lanka pavilion was constructed on a free of charge basis as part of an assistance package which would have otherwise cost Sri Lanka a large sum. “I repeat this was constructed by Expo at no cost to Sri Lanka. Also certain design elements of the pavilion had to be changed from the original layout in accordance with the EXPO DUBAI 2020 HSE guidelines,” she said.   


Fernando also said that there have been multiple suggestions by concerned and enthusiastic Sri Lankans to better Sri Lanka’s presence at the world stage.   
However, she said that with high global standards many of these are against the guidelines set by the organizers. “Serving Sri Lankan beverages like Thambili and Ranawara and other concepts were thought of but with the Covid and expo regulations these ideas could not be implemented. The traditional masks are showcased and we have multiple activities which has churned the interest of many visitors,” she said.   


Fernando also said that Sri Lanka cannot serve any food, unless otherwise they move for an exuberantly high investment and construct a dedicated kitchen fully in compliance with health and safety guidelines which at this point would not be feasible.   


Each country will have a day of their own at the EXPO and the dedicated day for Sri Lanka is the 03rd of January. Sri Lanka hopes to stage a wedding show, batik fashion show as well as a song, dance, drama and drums of Sri Lanka show. Also planned is the Sri Lankan night featuring Yohani in March 2022.   ",https://www.dailymirror.lk/print/front_page/Sri-Lanka-denies-allegations-raised-over-participation-at-Dubai-EXPO/238-223026,2021-10-22,sample_data/8_en.json
எரிபொருள் கொள்வனவிற்காக இந்தியாவிடமிருந்து 500 மில்லியன் டொலர் கடன்,"எரிபொருளை கொள்வனவு செய்வதற்காக இந்தியாவிடமிருந்து 500 மில்லியன் டொலர் கடனை பெறுவதற்கு அரசாங்கம் தீர்மானித்துள்ளது.

இந்திய உயர்ஸ்தானிகராலயத்தின் தலையீட்டின் கீழ், கடனுதவியை விரைவில் பெற்றுக்கொள்ளவுள்ளதாக பெட்ரோலிய கூட்டுத்தாபன தலைவர், சட்டத்தரணி சுமித் விஜேசிங்க தெரிவித்துள்ளார்.

கடனை பெற்றுக் கொள்வதற்கான உடன்படிக்கையில் நாட்டின் எரிசக்தி அமைச்சு மற்றும் இந்திய எரிசக்தி அமைச்சின் செயலாளர்கள் கைச்சாத்திடவுள்ளதாக நிதி அமைச்சின் செயலாளர் எஸ்.ஆர். ஆட்டிகல குறிப்பிட்டுள்ளார்.",https://www.newsfirst.lk/tamil/2021/10/17/%e0%ae%8e%e0%ae%b0%e0%ae%bf%e0%ae%aa%e0%af%8a%e0%ae%b0%e0%af%81%e0%ae%b3%e0%af%8d-%e0%ae%95%e0%af%8a%e0%ae%b3%e0%af%8d%e0%ae%b5%e0%ae%a9%e0%ae%b5%e0%ae%bf%e0%ae%b1%e0%af%8d%e0%ae%95%e0%ae%be%e0%ae%95/,2021-10-17,sample_data/9_ta.json
"ඉන්දියාව පිනවා ‘මැණිකේ’ යළි එයි
","මැණිකේ මගේ හිතේ ගීතයෙන් ලොව ජනාදරයට පත්වූ ශ්‍රී ලාංකීය නව පරපුරේ යොවුන් ගායන ශිල්පිනි යොහානි ද සිල්වා සිය ඉන්දීය සංචාරය නිම කර දිවයිනට පැමිණියා ය.

ඇය මව්බිමට පැමිණියේ, ඊයේ රාත්‍රී 11.25ට ඉන්දියාවේ මුම්බායි සිට ශ්‍රීලන්කන් ගුවන් සේවයේ යූ.එල්- 144 දරන ගුවන් යානයෙනි.

කටුනායක ගුවන් තොටුපළට පැමිණි යොහානිට උණුසුම් පිළිගැනීමක් හිමිවූ අතර ඇය ගුවන් තොටුපළෙන් පිටත්ව යන අවස්ථාවේදී විශේෂ ආරක්ෂාවක් ලබාදී තිබීම ද විශේෂතවයකි.

“මැණිකේ මගේ හිතේ ” ගීතයෙන් මෙරට මෙන්ම ජාත්‍යන්තරය ආදරය දිනාගත් යොහානි ද සිල්වාගේ පළමු ජාත්‍යන්තර ගෘහස්ත ප්‍රසංගය පසුගිය දා ඉන්දියාවේ නවදිල්ලියේදී පැවැත්විය.

ඇය සති දෙකකට ආසන්න කාලයක් ඉන්දියාවේ රැඳී සිටි අතර එහිදී බොලිවුඩ් චිත්‍රපටයක හින්දි භාෂාවෙන් පසුබිම් ගායනයට දායක වීමටත් ඇයට අවස්ථාව හිමිවිය.

එමෙන්ම යොහානි සුපිරි බොලිවුඩ් නළු සල්මන් ඛාන් සමග ඉන්දියාවේ අතිශය ජනප්‍රිය බිග් බොස් වැඩසටහනේ විශේෂ ආරාධිතයෙකු ලෙසත් සම්බන්ධ වූවා ය.

යොහානි ප්‍රතිනිර්මාණය කළ ‘මැණිකේ මගේ හිතේ” ගීතය යූ ටියුබ් නැරඹුම් වාර මිලියන 150 ඉක්මවා ගොස් තිබේ.",https://www.newsfirst.lk/sinhala/2021/10/13/%e0%b6%89%e0%b6%b1%e0%b7%8a%e0%b6%af%e0%b7%92%e0%b6%ba%e0%b7%8f%e0%b7%80-%e0%b6%b4%e0%b7%92%e0%b6%b1%e0%b7%80%e0%b7%8f-%e0%b6%b8%e0%b7%90%e0%b6%ab%e0%b7%92%e0%b6%9a%e0%b7%9a-%e0%b6%ba%e0%b7%85/,2021-10-13,sample_data/9_si.json
இலங்கையில் முதன்முறையான நடந்த அதிசய நிகழ்வு! வைத்தியர் வெளியிட்ட தகவல்,"இலங்கையில் முதல் முறையாக ஒரே பிரசவத்தில் 6 குழந்தைகள் பிறந்துள்ளன.

கொழும்பிலுள்ள பிரபல தனியார் வைத்தியசாலையில் இந்த குழந்தைகள் பிறந்துள்ளன. கொழும்பு அங்கொடை பிரதேசத்தை சேர்ந்த 31 வயதுடைய திலின் வாசனா என்ற பெண்ணே இந்த குழந்தைகளை பிரவசித்துள்ளார்.

இந்த குழந்தைகளை பிரசவிப்பதற்கான சிசேரியன் சத்திரசிகிச்சை மகப்பேறு மற்றும் மகளிர் மருத்துவ நிபுணர் டிரான் டயஸ் தலைமையில் நடைபெற்றுள்ளது. அவரது தலைமையில் 40 ஊழியர்கள் பங்கேற்றுள்ளனர்.

நள்ளிரவு 12.16 க்கு ஆரம்பமான இந்த சிசேரியன் சத்திரசிகிச்சையில் 3 நிமிடங்களுக்குள் 6 குழந்தைகளும் பிரசவிக்கப்பட்டுள்ளது.

இந்த விசேட சந்தர்ப்பத்தில் இணைந்த வைத்திய குழுவினர், இலங்கையில் முதல் முறையாக 6 குழந்தைகள் பிரசவிக்கப்பட்டமை தொடர்பில் ஊடகங்களுக்கு கருத்து வெளியிட்டுள்ளார்.

வயிற்றில் 2 குழந்தைகள் இருக்கும் தாய் ஒருவருக்கு 36 - 37 வாரத்திற்குள் பிரசவம் செய்வோம். 3 குழந்தைகள் இருக்கும் தாய்க்கு 35 வாரங்களில் பிரசவம் பார்ப்போம். எனினும் 6 குழந்தைகள் இருந்தால் எந்த காலத்தில் பிரசவம் பார்ப்பதென்பது குறித்து எங்களால் கண்டுபிடிக்க முடியவில்லை.

இந்த 6 குழந்தைகள் தொடர்பில் ஒவ்வொரு சந்தர்ப்பத்திலும் ஸ்கேன் செய்து பார்த்துக் கொண்டோம். இரண்டு குழந்தைகளின் இரத்த சீராக பயணிக்கவில்லை என கண்டுபிடித்தோம். அதற்கமைய 31 வாரங்களில் பிரசவம் பார்ப்பதற்கு தீர்மானித்தோம்.

இந்த குழந்தைகளில் முதல் குழந்தை 1 கிலோ 600 கிராமாகும். கடைசி குழந்தை 830 கிராமாகும். இது எங்கள் முதல் 6 குழந்தை பிரசவமாகும். இது மிகவும் சவாலாக இருந்தது.

இந்த குழந்தைகளை பிரசவிப்பதற்கு முன்னர் நாங்கள் பல்வேறு பயிற்சிகளையும் மேற்கொண்டோம். பொதுவான சிசேரியன் சத்திர சிகிச்சை செய்யும் முறையிலேயே இதனையும் செய்தோம்.

எனினும் 48 மணி நேரங்கள் தீவிர கண்கானிப்பில் தாயையும் குழந்தைகளையும் கண்கானிக்கி்றோம். ஒரு குழந்தை மாத்திரம் சுவாச கருவியின் உதவியுடன் வைக்கப்பட்டுள்ளது.

ஏனைய அனைத்து குழந்தைகளும் சீரான முறையில் சுவாசிக்கின்றார்கள். 2 அல்லது 3 வாரங்கள் அவர்களை வைத்தியசாலையில் வைத்துக் கொள்ள வேண்டும்” என தெரிவித்துள்ளனர். ",https://tamilwin.com/article/the-first-miraculous-event-in-sri-lanka-1634869584?itm_source=parsely-api,2021-10-22,sample_data/5_ta.json
"NO Fuel Price Hike & NO Fuel Shortage, assures Gammanpila","COLOMBO (News 1st); Sri Lanka’s Energy Minister Udaya Gammanpila said that there is no plan to hike fuel prices in the country.

Speaking to News 1st, the Minister also assured that there is no shortage of fuel in the country.",https://www.newsfirst.lk/2021/10/22/no-fuel-price-hike-no-fuel-shortage-assures-gammanpila/,2021-10-22,sample_data/4_en.json
”කිසිසේත් ඉන්ධන මිල වැඩි වෙන්නේ නැහැ..”- ඇමති ගම්මන්පිල,"ඉන්ධන මිල වැඩි කිරීමේ කිසිදු බලාපොරොත්තුවක් නොමැති බව බලශක්ති අමාත්‍ය උදය ගම්මන්පිල මහතා පවසයි.
අමාත්‍යවරයා සඳහන් කරන්නේ, රට තුළ කිසිදු ඉන්ධන හිඟයක් ද නොමැති බවයි.

මේ අතර  ලංකා ඛනිජ නීතිගත සංස්ථාව පවසන්නේ, ඉන්ධන මිල සම්බන්ධයෙන් අද (22) පස්වරුවේ සාකච්ඡාවක් පැවැත්වෙන බවයි.

විෂය භාර අමාත්‍ය උදය ගම්මන්පිල මහතා සමග එම සාකච්ඡාවක් පැවැත්වෙන බව එහි සභාපති සුමිත් විජේසිංහ මහතා පැවසී ය.",https://www.newsfirst.lk/sinhala/2021/10/22/%e0%b6%9a%e0%b7%92%e0%b7%83%e0%b7%92%e0%b7%83%e0%b7%9a%e0%b6%ad%e0%b7%8a-%e0%b6%89%e0%b6%b1%e0%b7%8a%e0%b6%b0%e0%b6%b1-%e0%b6%b8%e0%b7%92%e0%b6%bd-%e0%b7%80%e0%b7%90%e0%b6%a9%e0%b7%92-%e0%b7%80/,2021-10-22,sample_data/1_si.json
வெளிநாட்டு கடவுச்சீட்டு வழங்கும் நடவடிக்கை தற்காலிகமாக நிறுத்தம்,"வெளிநாட்டு கடவுச்சீட்டு பெற்றுக்கொள்வதில் திடீரென ஏற்பட்ட அதிகரிப்பு காரணமாக அதனை பெற்றுக் கொள்வதற்கு நேரம் ஒதுக்கிக் கொள்ளவிருந்த வசதி ஒக்டோபர் மாதம் வரை முழுமை அடைந்துள்ளது.

இதன் காரணமாக முன்கூட்டியே நேரம் ஒதுக்கிக் கொள்வதற்கான சந்தர்ப்பம் எதிர்வரும் நவம்பர் மாதத்திலேயே உள்ளதென குடிவரவு குடியகல்வு திணைக்களம் தெரிவித்துள்ளது.

முற்கூட்டியே நேரம் அல்லது திகதியை ஒதுக்கிக் கொள்வதற்கான வசதிகளின் கீழ் நாள் ஒன்றுக்கு 1000 கடவுச்சீட்டுகள் வெளியிடப்படுவதாக திணைக்களத்தின் குடிவரவு குடியகல்வு திணைக்களத்தின் கடவுச்சீட்டு பிரிவு கட்டுப்பாட்டு அதிகாரி எச்.பீ.சந்திரலால் தெரிவித்துள்ளார்.

கடந்த 18ஆம் திகதி மாத்திரம் ஒரு நாள் மற்றும் பொது சேவையின் கீழ் 4700 விண்ணப்பங்களை ஏற்க நேரிட்டுள்ளது. இதனால் எல்லையற்ற அளவு வெளிநாட்டு கடவுச்சீட்டுகள் வழங்கப்படுவதனால் குடிவரவு மற்றும் குடியகல்வு திணைக்களம் கடும் நெருக்கடிக்குள்ளாகியுள்ளது.

எனினும் எதிர்வரும் நவம்பர் மாதம் முதல் இந்த நெருக்கடி குறையும் என தான் நம்புவதாக குடிவரவு குடியகல்வு திணைக்களத்தின் கடவுச்சீட்டு பிரிவு கட்டுப்பாட்டு அதிகாரி எச்.பீ.சந்திரலால் மேலும் தெரிவித்துள்ளார்.",https://tamilwin.com/article/passport-providing-suspended-1634785728?itm_source=parsely-api,2021-10-21,sample_data/4_ta.json
LIOC to increase Diesel and Petrol prices by Rs.5,"The Lanka IOC has increased its retail selling prices for both Diesel (Lanka Auto Diesel) & Petrol (LP 92 ) by Rs. 5 per litre from tonight due to huge losses on sales of both the products. 

The LIOC Manager Commercial Manjula Abeywickrama said the prices of Lanka Super Diesel and LP 95 have been kept unchanged. 

The losses are around Rs. 40 per litre on sale of Diesel and Rs. 20 per litrer on sale of Petrol at the current international prices. 

The last price revision took place on June 12. However, since then the Brent crude oil prices have increased from $72 to $86 per barrel in the international market. 

However, even after this price increase in Diesel and Petrol, LIOC will still have to bear significant losses at prevailing international prices for which they have been requesting to Ministry of Finance and Ministry of Energy to take necessary steps to provide relief to organization, Abeywickrama said.",https://www.dailymirror.lk/top_story/LIOC-to-increase-Diesel-and-Petrol-prices-by-Rs-5/155-222998,2021-10-21,sample_data/5_en.json
20 යි 20 ලෝක කුසලානය: නෙදර්ලන්ත – ශ්‍රී ලංකා තරගය අද,"පන්දුවාර 20 යි 20 ලෝක කුසලාන ක්‍රිකට් තරගාවලියේ, සුදුසුකම් ලැබීමේ තරග වටයේ, ශ්‍රී ලංකා සහ නෙදර්ලන්ත කණ්ඩායම් අතර තරගය අද (22) සාජාහිදී පැවැත්වීමට නියමිතයි .
තරගය මෙරට වේලාවෙන් රාත්‍රී 7 .30 ට ආරම්භ වනු ඇති.

ශ්‍රී ලංකා කණ්ඩායම මේ වන විටත් මෙවර පන්දුවාර 20 යි 20 ලෝක කුසලාන ක්‍රිකට් තරගාවලියේ සුපිරි කණ්ඩායම් 12 දෙනාගේ වටයේ සිය ස්ථානය තහවුරු කර ගෙන අවසන් ය.",https://www.newsfirst.lk/sinhala/2021/10/22/20-%e0%b6%ba%e0%b7%92-20-%e0%b6%bd%e0%b7%9d%e0%b6%9a-%e0%b6%9a%e0%b7%94%e0%b7%83%e0%b6%bd%e0%b7%8f%e0%b6%b1%e0%b6%ba-%e0%b6%b1%e0%b7%99%e0%b6%af%e0%b6%bb%e0%b7%8a%e0%b6%bd%e0%b6%b1%e0%b7%8a%e0%b6%ad/,2021-10-22,sample_data/8_si.json
தொழிலுக்காக வெளிநாடு செல்வோருக்கு விசேட அறிவிப்பு,"தொழிலுக்காக வெளிநாடுகளுக்குச் செல்பவர்கள் இடைத்தரகர்களிடம் சிக்காமல், தங்களது செயற்பாடுகளை முன்னெடுக்குமாறு வெளிநாட்டு வேலை வாய்ப்பு பணியகம் அறிவுறுத்தியுள்ளது.

வெளிநாட்டு வேலை வாய்ப்புக்கான நேரடி அணுகல்களை அதன் கட்டுப்பாட்டின் கீழ் உரிமம் பெற்ற தரப்பினரிடமிருந்து மாத்திரம் பெற்றுக்கொள்ளுமாறு அந்தப் பணியகம் விடுத்துள்ள அறிக்கையில் குறிப்பிடப்பட்டுள்ளது.

அத்துடன், உரிமம் பெற்ற 800 முகவர்கள் மற்றும் நிறுவனங்கள் உள்ளதாக வெளிநாட்டு வேலை வாய்ப்பு பணியகம் சுட்டிக்காட்டியுள்ளது.

தொழில் வாய்ப்புகளுக்காக வெளிநாடு செல்வதில் ஏதேனும் சிக்கல் நிலை காணப்படுமாயின் வெளிநாட்டு வேலை வாய்ப்பு பணியகத்தின் 1989 என்ற இலக்கத்திற்கு அழைப்பை மேற்கொள்ள முடியும் என அறிவிக்கப்பட்டுள்ளது.",https://www.tamilmirror.lk/%E0%AE%9A%E0%AF%86%E0%AE%AF%E0%AF%8D%E0%AE%A4%E0%AE%BF%E0%AE%95%E0%AE%B3%E0%AF%8D/%E0%AE%A4%E0%AE%B4%E0%AE%B2%E0%AE%95%E0%AE%95%E0%AE%95-%E0%AE%B5%E0%AE%B3%E0%AE%A8%E0%AE%9F-%E0%AE%9A%E0%AE%B2%E0%AE%B5%E0%AE%B0%E0%AE%95%E0%AE%95-%E0%AE%B5%E0%AE%9A%E0%AE%9F-%E0%AE%85%E0%AE%B1%E0%AE%B5%E0%AE%AA%E0%AE%AA/175-283615,2021-10-21,sample_data/6_ta.json
ලබන 31 වනදා සිට පළාත් අතර සංචරණ සීමා ඉවතට,"දැනට ක්‍රියාත්මක පළාත් සංචරණ සීමා ඔක්තෝබර් 31 අලුයම 4.00 ට ඉවත් කරන බව කොවිඩ් – 19 පැතිරීම වැළැක්වීමේ ජාතික ක්‍රියාන්විත මධ්‍යස්ථානයේ ප්‍රධානි, ආරක්ෂක මාණ්ඩලික ප්‍රධානි සහ යුද්ධ හමුදාපති ජෙනරාල් ශවේන්ද්‍ර සිල්වා මහතා පවසයි.
යුද හමුදාපතිවරයා සඳහන් කළේ, සෞඛ්‍ය සේවකයින්, ත්‍රිවිද හමුදාව, පොලීසිය ඇතුළු ඉදිරි පෙළ කාර්ය මණ්ඩල සඳහා තෙවැනි මාත්‍රාව (බූස්ටර් එන්නතක්) ලබා දීම නොවැම්බර් 01 වැනිදායින් පසු ආරම්භ කරන බවයි.",https://www.newsfirst.lk/sinhala/2021/10/22/news-just-in-%e0%b6%bd%e0%b6%b6%e0%b6%b1-31-%e0%b7%80%e0%b6%b1%e0%b6%af%e0%b7%8f-%e0%b7%83%e0%b7%92%e0%b6%a7-%e0%b6%b4%e0%b7%85%e0%b7%8f%e0%b6%ad%e0%b7%8a-%e0%b6%85%e0%b6%ad%e0%b6%bb-%e0%b7%83/,2021-10-22,sample_data/10_si.json
මේ ගැන පොත්වල විස්තර නෑ. අත්දැකීමෙන් සහ පළපුරුද්දෙන් කළේ.,"කොළඹ, පෞද්ගලික රෝහලකදී උපත ලැබූ දරුවන් හයදෙනා මේ වන විට හොඳ සෞඛ්‍ය තත්ත්වයෙන් සිටින බව වෛද්‍යවරු පවසති.

ඔක්තෝම්බර් 20 වැනිදා රාත්‍රී 12.16ට පමණ උපත ලද මේ දරුවන් බිහි කළ මව කොළඹ IDH ප්‍රදේශයේ පදිංචිකාරිනියකි.

මහාචාර්ය ටිරාන් ඩයස්ගේ ප්‍රධානත්වයෙන් යුතු වෛද්‍ය කණ්ඩායමක් සිසේරියන් සැත්කම සිදුකර තිබේ.

ශ්‍රී ලංකාවෙන් සය නිවුන් දරු උපතක් වාර්තා වෙන ප්‍රථම අවස්ථාව මෙය බව නව ජන්ම ළදරුවන් පිළිබඳ විශේෂඥ වෛද්‍ය නලීන් ගමඇතිගේ පවසයි.",https://www.bbc.com/sinhala/sri-lanka-58993273,2021-10-21,sample_data/3_si.json
